{"$schema":"https://json-schema.org/draft/2020-12/schema","$id":"https://quirk.systems/schemas/collection.schema.json","title":"Quirk Card Collection","type":"object","additionalProperties":false,"required":["collection_id","owner_ref","version","card_instances","ownership_semantics"],"properties":{"collection_id":{"type":"string","pattern":"^collection\\.[a-z0-9._-]+$"},"owner_ref":{"type":"string"},"version":{"type":"string","pattern":"^[0-9]+\\.[0-9]+\\.[0-9]+$"},"card_instances":{"type":"array","items":{"$ref":"https://quirk.systems/schemas/card-instance.schema.json"},"uniqueItems":true},"ownership_semantics":{"const":"only_access_kind_owned_is_owned"},"exportable":{"type":"boolean"},"metadata":{"type":"object"}}}