{"collection_id":"collection.bryan.deck-grammar-proof","owner_ref":"human.bryan","version":"0.1.0","card_instances":[{"instance_id":"card-instance.owned.persona-brayn","card_id":"card.persona.brayn","holder_ref":"human.bryan","access_kind":"owned","state":"accessible","acquired_at":"2026-08-12T00:00:00Z","expires_at":null,"entitlement_ref":null,"ownership_claim":"owned","authority_effect":"none","edition":"candidate-v0.1","provenance_refs":["conversation://deck-grammar-candidate-pack"],"metadata":{}},{"instance_id":"card-instance.owned.persona-bryan","card_id":"card.persona.bryan","holder_ref":"human.bryan","access_kind":"owned","state":"accessible","acquired_at":"2026-08-12T00:00:00Z","expires_at":null,"entitlement_ref":null,"ownership_claim":"owned","authority_effect":"none","edition":"candidate-v0.1","provenance_refs":["conversation://deck-grammar-candidate-pack"],"metadata":{}},{"instance_id":"card-instance.owned.persona-brayk","card_id":"card.persona.brayk","holder_ref":"human.bryan","access_kind":"owned","state":"accessible","acquired_at":"2026-08-12T00:00:00Z","expires_at":null,"entitlement_ref":null,"ownership_claim":"owned","authority_effect":"none","edition":"candidate-v0.1","provenance_refs":["conversation://deck-grammar-candidate-pack"],"metadata":{}},{"instance_id":"card-instance.owned.persona-bryminn","card_id":"card.persona.bryminn","holder_ref":"human.bryan","access_kind":"owned","state":"accessible","acquired_at":"2026-08-12T00:00:00Z","expires_at":null,"entitlement_ref":null,"ownership_claim":"owned","authority_effect":"none","edition":"candidate-v0.1","provenance_refs":["conversation://deck-grammar-candidate-pack"],"metadata":{}},{"instance_id":"card-instance.owned.aesthetic-structural-clarity","card_id":"card.aesthetic.structural-clarity","holder_ref":"human.bryan","access_kind":"owned","state":"accessible","acquired_at":"2026-08-12T00:00:00Z","expires_at":null,"entitlement_ref":null,"ownership_claim":"owned","authority_effect":"none","edition":"candidate-v0.1","provenance_refs":["conversation://deck-grammar-candidate-pack"],"metadata":{}},{"instance_id":"card-instance.owned.aesthetic-premium-chaos","card_id":"card.aesthetic.premium-chaos","holder_ref":"human.bryan","access_kind":"owned","state":"accessible","acquired_at":"2026-08-12T00:00:00Z","expires_at":null,"entitlement_ref":null,"ownership_claim":"owned","authority_effect":"none","edition":"candidate-v0.1","provenance_refs":["conversation://deck-grammar-candidate-pack"],"metadata":{}},{"instance_id":"card-instance.owned.aesthetic-lyric-nonce","card_id":"card.aesthetic.lyric-nonce","holder_ref":"human.bryan","access_kind":"owned","state":"accessible","acquired_at":"2026-08-12T00:00:00Z","expires_at":null,"entitlement_ref":null,"ownership_claim":"owned","authority_effect":"none","edition":"candidate-v0.1","provenance_refs":["conversation://deck-grammar-candidate-pack"],"metadata":{}},{"instance_id":"card-instance.owned.aesthetic-performance-pressure","card_id":"card.aesthetic.performance-pressure","holder_ref":"human.bryan","access_kind":"owned","state":"accessible","acquired_at":"2026-08-12T00:00:00Z","expires_at":null,"entitlement_ref":null,"ownership_claim":"owned","authority_effect":"none","edition":"candidate-v0.1","provenance_refs":["conversation://deck-grammar-candidate-pack"],"metadata":{}},{"instance_id":"card-instance.owned.affordance-source-authority-census","card_id":"card.affordance.source-authority-census","holder_ref":"human.bryan","access_kind":"owned","state":"accessible","acquired_at":"2026-08-12T00:00:00Z","expires_at":null,"entitlement_ref":null,"ownership_claim":"owned","authority_effect":"none","edition":"candidate-v0.1","provenance_refs":["conversation://deck-grammar-candidate-pack"],"metadata":{}},{"instance_id":"card-instance.owned.affordance-contract-diff","card_id":"card.affordance.contract-diff","holder_ref":"human.bryan","access_kind":"owned","state":"accessible","acquired_at":"2026-08-12T00:00:00Z","expires_at":null,"entitlement_ref":null,"ownership_claim":"owned","authority_effect":"none","edition":"candidate-v0.1","provenance_refs":["conversation://deck-grammar-candidate-pack"],"metadata":{}},{"instance_id":"card-instance.owned.affordance-section-map","card_id":"card.affordance.section-map","holder_ref":"human.bryan","access_kind":"owned","state":"accessible","acquired_at":"2026-08-12T00:00:00Z","expires_at":null,"entitlement_ref":null,"ownership_claim":"owned","authority_effect":"none","edition":"candidate-v0.1","provenance_refs":["conversation://deck-grammar-candidate-pack"],"metadata":{}},{"instance_id":"card-instance.owned.affordance-narrative-progression","card_id":"card.affordance.narrative-progression","holder_ref":"human.bryan","access_kind":"owned","state":"accessible","acquired_at":"2026-08-12T00:00:00Z","expires_at":null,"entitlement_ref":null,"ownership_claim":"owned","authority_effect":"none","edition":"candidate-v0.1","provenance_refs":["conversation://deck-grammar-candidate-pack"],"metadata":{}},{"instance_id":"card-instance.owned.asset-evidence-pack","card_id":"card.asset.evidence-pack","holder_ref":"human.bryan","access_kind":"owned","state":"accessible","acquired_at":"2026-08-12T00:00:00Z","expires_at":null,"entitlement_ref":null,"ownership_claim":"owned","authority_effect":"none","edition":"candidate-v0.1","provenance_refs":["conversation://deck-grammar-candidate-pack"],"metadata":{}},{"instance_id":"card-instance.owned.asset-creative-reference-bank","card_id":"card.asset.creative-reference-bank","holder_ref":"human.bryan","access_kind":"owned","state":"accessible","acquired_at":"2026-08-12T00:00:00Z","expires_at":null,"entitlement_ref":null,"ownership_claim":"owned","authority_effect":"none","edition":"candidate-v0.1","provenance_refs":["conversation://deck-grammar-candidate-pack"],"metadata":{}}],"ownership_semantics":"only_access_kind_owned_is_owned","exportable":true,"metadata":{"purpose":"live proof"}}